{
  "protocol": "ZARA-EXPERT/1",
  "request_id": "req-42",
  "operation": "expert.invoke",
  "activation_id": "act-7",
  "expert_id": "zara:expert/android-troubleshooting",
  "expert_operation": "diagnose",
  "expected_registry_generation": 12,
  "expected_runtime_generation": 4,
  "input": {
    "symptom_id": "adb_no_devices"
  },
  "limits": {
    "timeout_ms": 3000,
    "max_results": 8,
    "max_output_bytes": 65536,
    "max_model_calls": 0
  }
}
